{
  "schema_version": "aud-task-model-v1",
  "model_id": "TM-INTEGRATION-001",
  "project_revision": "da063c38731f3f797bfd5000374daa5c14952782",
  "tasks": [{
    "id": "TASK-03",
    "persona_ref": "researcher",
    "role_ref": "member",
    "journey_stage_ref": "compare",
    "verb": "compare",
    "object": "source claims",
    "success_criterion": "Return from evidence without losing comparison state",
    "required_information": ["claim", "source", "confidence"],
    "frequency": 0.8,
    "criticality": 0.9,
    "time_sensitivity": 0.5,
    "user_coverage": 0.7,
    "source_ref": "SRC-1",
    "evidence_strength": 0.75,
    "last_confirmed": "2026-09-04T09:00:00Z"
  }],
  "sources": ["SRC-1"],
  "assumptions": []
}
